,number,value,datetime_start,datetime_complete,duration,params_activation,params_filters,params_kernel_size,params_padding,params_strides,system_attrs_nsga2:generation,system_attrs_nsga2:parents,state
0,0,0.629999995,06:08.0,06:17.2,0 days 00:00:09.211534,swish,32,1,causal,2,0,,COMPLETE
1,1,0.606999993,06:17.2,06:27.5,0 days 00:00:10.287612,relu,64,2,causal,2,0,,COMPLETE
2,2,0.601000011,06:27.5,06:37.3,0 days 00:00:09.724301,relu,32,1,same,2,0,,COMPLETE
3,3,0.598999977,06:37.3,06:47.1,0 days 00:00:09.871085,relu,32,2,valid,1,0,,COMPLETE
4,4,0.595000029,06:47.1,06:56.9,0 days 00:00:09.733444,relu,64,2,causal,2,0,,COMPLETE
5,5,0.595000029,06:56.9,07:06.6,0 days 00:00:09.691673,elu,32,2,causal,1,0,,COMPLETE
6,6,0.595000029,07:06.6,07:16.2,0 days 00:00:09.621327,swish,64,1,valid,2,0,,COMPLETE
7,7,0.592999995,07:16.2,07:30.0,0 days 00:00:13.851733,swish,64,1,causal,2,0,,COMPLETE
8,8,0.592999995,07:30.0,07:39.9,0 days 00:00:09.881928,elu,32,2,same,1,0,,COMPLETE
9,9,0.592000008,07:39.9,07:50.2,0 days 00:00:10.244256,elu,32,1,causal,2,0,,COMPLETE
10,10,0.591000021,07:50.2,08:00.5,0 days 00:00:10.323625,swish,64,1,causal,1,0,,COMPLETE
11,11,0.591000021,08:00.5,08:10.2,0 days 00:00:09.713676,swish,64,2,same,2,0,,COMPLETE
12,12,0.589999974,08:10.2,08:20.5,0 days 00:00:10.274951,elu,32,1,causal,1,0,,COMPLETE
13,13,0.588999987,08:20.5,08:29.7,0 days 00:00:09.212085,relu,64,2,valid,1,0,,COMPLETE
14,14,0.587000012,08:29.7,08:39.0,0 days 00:00:09.328706,relu,64,2,valid,1,0,,COMPLETE
15,15,0.587000012,08:39.0,08:51.7,0 days 00:00:12.682332,elu,32,1,same,1,0,,COMPLETE
16,16,0.586000025,08:51.7,09:00.7,0 days 00:00:08.972216,swish,64,2,valid,2,0,,COMPLETE
17,17,0.586000025,09:00.7,09:10.4,0 days 00:00:09.716817,elu,32,1,causal,1,0,,COMPLETE
18,18,0.584999979,09:10.4,09:19.4,0 days 00:00:08.994545,swish,32,2,same,2,0,,COMPLETE
19,19,0.583999991,09:19.4,09:28.3,0 days 00:00:08.939845,relu,64,1,same,2,0,,COMPLETE
20,20,0.583999991,09:28.3,09:37.7,0 days 00:00:09.377819,swish,32,2,causal,2,0,,COMPLETE
21,21,0.582000017,09:37.7,09:46.8,0 days 00:00:09.060350,swish,32,1,causal,1,0,,COMPLETE
22,22,0.58099997,09:46.8,09:56.6,0 days 00:00:09.770896,swish,32,1,valid,1,0,,COMPLETE
23,23,0.58099997,09:56.6,10:05.3,0 days 00:00:08.705447,elu,32,1,causal,2,0,,COMPLETE
24,24,0.575999975,10:05.3,10:14.2,0 days 00:00:08.965490,elu,32,1,same,1,0,,COMPLETE
25,25,0.575999975,10:14.2,10:23.2,0 days 00:00:08.999159,elu,32,2,same,1,0,,COMPLETE
26,26,0.574999988,10:23.2,10:31.9,0 days 00:00:08.664714,elu,32,2,valid,2,0,,COMPLETE
27,27,0.574999988,10:31.9,10:41.0,0 days 00:00:09.094304,relu,32,2,same,1,0,,COMPLETE
28,28,0.574000001,10:41.0,10:51.2,0 days 00:00:10.174465,swish,32,1,causal,2,0,,COMPLETE
29,29,0.573000014,10:51.2,11:04.4,0 days 00:00:13.179186,swish,32,1,causal,2,0,,COMPLETE
30,30,0.573000014,11:04.4,11:14.5,0 days 00:00:10.158488,relu,64,2,causal,1,0,,COMPLETE
31,31,0.573000014,11:14.5,11:24.6,0 days 00:00:10.067142,elu,32,1,causal,1,0,,COMPLETE
32,32,0.572000027,11:24.6,11:34.3,0 days 00:00:09.723367,relu,32,1,same,1,0,,COMPLETE
33,33,0.572000027,11:34.3,11:45.3,0 days 00:00:10.966996,swish,64,2,same,1,0,,COMPLETE
34,34,0.57099998,11:45.3,11:55.6,0 days 00:00:10.284738,swish,64,1,same,1,0,,COMPLETE
35,35,0.569999993,11:55.6,12:05.0,0 days 00:00:09.448415,relu,32,1,causal,2,0,,COMPLETE
36,36,0.569999993,12:05.0,12:15.1,0 days 00:00:10.053028,relu,64,2,valid,1,0,,COMPLETE
37,37,0.568000019,12:15.1,12:25.8,0 days 00:00:10.708056,swish,32,2,valid,1,0,,COMPLETE
38,38,0.566999972,12:25.8,12:37.4,0 days 00:00:11.603077,elu,64,2,causal,2,0,,COMPLETE
39,39,0.566999972,12:37.4,12:46.6,0 days 00:00:09.227651,elu,32,2,same,2,0,,COMPLETE
40,40,0.563000023,12:46.6,12:55.7,0 days 00:00:09.068812,elu,32,2,valid,1,0,,COMPLETE
41,41,0.563000023,12:55.7,13:05.0,0 days 00:00:09.293342,swish,32,2,same,1,0,,COMPLETE
42,42,0.563000023,13:05.0,13:13.9,0 days 00:00:08.944840,swish,32,1,causal,2,0,,COMPLETE
43,43,0.561999977,13:13.9,13:23.0,0 days 00:00:09.019349,swish,64,2,same,2,0,,COMPLETE
44,44,0.561999977,13:23.0,13:36.3,0 days 00:00:13.379722,relu,64,2,same,2,0,,COMPLETE
45,45,0.561999977,13:36.3,13:45.6,0 days 00:00:09.252499,relu,64,2,valid,1,0,,COMPLETE
46,46,0.56099999,13:45.6,13:54.4,0 days 00:00:08.778042,swish,32,1,valid,2,0,,COMPLETE
47,47,0.56099999,13:54.4,14:03.2,0 days 00:00:08.794167,elu,64,1,valid,2,0,,COMPLETE
48,48,0.56099999,14:03.2,14:15.9,0 days 00:00:12.764912,elu,64,1,causal,1,0,,COMPLETE
49,49,0.559000015,14:15.9,14:28.7,0 days 00:00:12.759378,relu,64,2,same,2,0,,COMPLETE
50,50,0.559000015,14:28.7,14:37.8,0 days 00:00:09.057797,relu,32,2,valid,1,1,"[3, 3]",COMPLETE
51,51,0.559000015,14:37.8,14:46.7,0 days 00:00:08.961655,elu,64,1,causal,2,1,"[28, 9]",COMPLETE
52,52,0.559000015,14:46.7,14:56.2,0 days 00:00:09.518038,swish,32,2,same,2,1,"[2, 16]",COMPLETE
53,53,0.558000028,14:56.2,15:05.5,0 days 00:00:09.227344,elu,32,2,same,2,1,"[41, 39]",COMPLETE
54,54,0.558000028,15:05.5,15:18.3,0 days 00:00:12.829689,elu,64,1,causal,1,1,"[9, 6]",COMPLETE
55,55,0.558000028,15:18.3,15:28.9,0 days 00:00:10.554612,relu,64,1,same,1,1,"[3, 10]",COMPLETE
56,56,0.556999981,15:28.9,15:38.7,0 days 00:00:09.808801,swish,64,2,same,2,1,"[40, 33]",COMPLETE
57,57,0.556999981,15:38.7,15:48.3,0 days 00:00:09.629957,relu,32,2,causal,1,1,"[28, 30]",COMPLETE
58,58,0.555999994,15:48.3,15:57.8,0 days 00:00:09.548562,elu,32,1,valid,1,1,"[22, 9]",COMPLETE
59,59,0.555999994,15:57.8,16:07.5,0 days 00:00:09.699436,relu,32,2,same,1,1,"[20, 45]",COMPLETE
60,60,0.555000007,16:07.5,16:18.2,0 days 00:00:10.610871,relu,64,1,causal,1,1,"[7, 36]",COMPLETE
61,61,0.555000007,16:18.2,16:28.5,0 days 00:00:10.322912,swish,64,2,same,1,1,"[8, 30]",COMPLETE
62,62,0.55400002,16:28.5,16:38.1,0 days 00:00:09.654205,elu,32,2,causal,1,1,"[17, 41]",COMPLETE
63,63,0.551999986,16:38.1,16:48.1,0 days 00:00:09.914404,elu,64,1,valid,1,1,"[40, 17]",COMPLETE
64,64,0.550999999,16:48.1,16:57.8,0 days 00:00:09.725045,swish,64,1,causal,2,1,"[10, 10]",COMPLETE
65,65,0.550999999,16:57.8,17:08.0,0 days 00:00:10.181588,elu,32,2,valid,2,1,"[28, 28]",COMPLETE
66,66,0.550000012,17:08.0,17:17.3,0 days 00:00:09.337882,elu,32,1,causal,2,1,"[35, 12]",COMPLETE
67,67,0.550000012,17:17.3,17:26.2,0 days 00:00:08.921591,swish,32,1,valid,2,1,"[3, 28]",COMPLETE
68,68,0.549000025,17:26.2,17:39.0,0 days 00:00:12.755508,swish,64,1,valid,1,1,"[34, 32]",COMPLETE
69,69,0.547999978,17:39.0,17:47.8,0 days 00:00:08.805099,relu,64,1,same,2,1,"[44, 24]",COMPLETE
70,70,0.546999991,17:47.8,17:57.9,0 days 00:00:10.108571,swish,64,1,causal,1,1,"[16, 12]",COMPLETE
71,71,0.546000004,17:57.9,18:07.1,0 days 00:00:09.228141,relu,64,1,causal,1,1,"[44, 48]",COMPLETE
72,72,0.54400003,18:07.1,18:16.6,0 days 00:00:09.437474,relu,64,2,same,1,1,"[36, 30]",COMPLETE
73,73,0.54400003,18:16.6,18:25.9,0 days 00:00:09.319610,swish,32,2,causal,1,1,"[15, 37]",COMPLETE
74,74,0.54400003,18:25.9,18:35.2,0 days 00:00:09.336753,swish,32,2,same,1,1,"[27, 27]",COMPLETE
75,75,0.54400003,18:35.2,18:45.2,0 days 00:00:09.949931,elu,32,2,same,1,1,"[41, 24]",COMPLETE
76,76,0.542999983,18:45.2,18:54.3,0 days 00:00:09.061418,elu,32,2,causal,2,1,"[35, 38]",COMPLETE
77,77,0.542999983,18:54.3,19:03.6,0 days 00:00:09.347661,relu,64,2,causal,1,1,"[43, 30]",COMPLETE
78,78,0.541000009,19:03.6,19:16.3,0 days 00:00:12.663940,relu,32,1,causal,1,1,"[5, 35]",COMPLETE
79,79,0.540000021,19:16.3,19:29.3,0 days 00:00:13.012905,relu,64,2,valid,1,1,"[24, 30]",COMPLETE
80,80,0.540000021,19:29.3,19:39.0,0 days 00:00:09.712293,swish,64,1,causal,2,1,"[10, 22]",COMPLETE
81,81,0.537999988,19:39.0,19:50.0,0 days 00:00:10.960920,swish,32,1,valid,1,1,"[16, 37]",COMPLETE
82,82,0.537999988,19:50.0,19:59.8,0 days 00:00:09.863934,swish,64,1,causal,2,1,"[7, 28]",COMPLETE
83,83,0.537999988,19:59.8,20:09.8,0 days 00:00:09.922800,elu,32,2,causal,1,1,"[5, 27]",COMPLETE
84,84,0.537,20:09.8,20:19.7,0 days 00:00:09.897688,swish,32,2,valid,1,1,"[41, 13]",COMPLETE
85,85,0.537,20:19.7,20:30.2,0 days 00:00:10.502144,swish,64,1,same,1,1,"[21, 11]",COMPLETE
86,86,0.535000026,20:30.2,20:40.5,0 days 00:00:10.308723,relu,32,1,causal,2,1,"[35, 0]",COMPLETE
87,87,0.531000018,20:40.5,20:50.5,0 days 00:00:10.044267,relu,64,2,causal,1,1,"[10, 3]",COMPLETE
88,88,0.531000018,20:50.5,21:00.7,0 days 00:00:10.201550,swish,64,1,causal,1,1,"[7, 48]",COMPLETE
89,89,0.528999984,21:00.7,21:11.1,0 days 00:00:10.349187,swish,64,1,same,1,1,"[33, 21]",COMPLETE
90,90,0.526000023,21:11.1,21:20.5,0 days 00:00:09.445075,relu,32,2,causal,2,1,"[28, 4]",COMPLETE
91,91,0.526000023,21:20.5,21:29.4,0 days 00:00:08.880444,swish,32,1,same,2,1,"[28, 28]",COMPLETE
92,92,0.523999989,21:29.4,21:39.4,0 days 00:00:09.981720,relu,64,2,valid,1,1,"[36, 14]",COMPLETE
93,93,0.514999986,21:39.4,21:48.4,0 days 00:00:09.028502,swish,64,1,same,2,1,"[0, 33]",COMPLETE
94,94,0.514999986,21:48.4,21:57.4,0 days 00:00:09.023647,swish,64,2,same,2,1,"[33, 27]",COMPLETE
95,95,0.512000024,21:57.4,22:10.2,0 days 00:00:12.715002,relu,64,1,same,2,1,"[33, 16]",COMPLETE
96,96,0.50999999,22:10.2,22:19.2,0 days 00:00:09.081103,relu,32,1,causal,1,1,"[17, 27]",COMPLETE
97,97,0.507000029,22:19.2,22:29.4,0 days 00:00:10.172107,swish,64,1,valid,1,1,"[20, 37]",COMPLETE
98,98,0.499000013,22:29.4,22:38.7,0 days 00:00:09.322756,relu,64,1,valid,1,1,"[10, 3]",COMPLETE
99,99,0.499000013,22:38.7,22:47.7,0 days 00:00:08.951067,relu,64,1,causal,2,1,"[30, 35]",COMPLETE
